ticker,date,date_ym,date_raw,title,text,url,source_page
AKRN,2026-02-04,2026-02,04.02.26,"""Акрон"" разместил биржевые облигации на 1,5 млрд юаней","Эмитент реализовал по открытой подписке 1,5 млн. облигаций серии БО-002Р-02 номинальной стоимостью 1000 юаней каждая",https://bonds.finam.ru/news/item/-akron-razmestil-birzhevye-obligatsii-na-1-5-mlrd-yuaney/,https://www.finam.ru/quote/moex/akrn/publications/
AKRN,2026-01-29,2026-01,29.01.26,"Ставка 1-го купона по облигациям ""Акрона"" на 1,5 млрд юаней составит 6,8% годовых","Первоначально ориентир по ставке 1-го купона находился в диапазоне 7,25-7,50% годовых",https://bonds.finam.ru/news/item/stavka-1-go-kupona-po-obligatsiam-akrona-na-1-5-mlrd-yuaney-sostavit-6-8-godovykh/,https://www.finam.ru/quote/moex/akrn/publications/
AKRN,2026-01-26,2026-01,26.01.26,"В 2026 году рост производства ""Акрона"" продолжится","Компания может нарастить производство до 9,4 млн тонн",https://www.finam.ru/publications/item/v-2026-godu-rost-proizvodstva-akrona-prodolzhitsya-20260126-1850/,https://www.finam.ru/quote/moex/akrn/publications/
AKRN,2026-01-26,2026-01,26.01.26,Товарный выпуск основной продукции “Акрона” за 2025 год вырос на 7%,Выпуск минеральных удобрений вырос на 5%,https://www.finam.ru/publications/item/tovarnyy-vypusk-osnovnoy-produktsii-akrona-za-2025-god-vyros-na-7-20260126-1211/,https://www.finam.ru/quote/moex/akrn/publications/
AKRN,2026-01-22,2026-01,22.01.26,"""Акрон"" 28 января проведет сбор заявок на облигации объемом от 1 млрд юаней","Ориентир ставки 1-го купона находится в диапазоне 7,25-7,50% годовых",https://bonds.finam.ru/news/item/-akron-28-yanvarya-provedet-sbor-zayavok-na-obligatsii-obemom-ot-1-mlrd-yuaney/,https://www.finam.ru/quote/moex/akrn/publications/
AKRN,2026-01-20,2026-01,20.01.26,"Рынок сползает вниз, в числе фаворитов дня – «Селигдар», «Акрон» и «НОВАТЭК»",«Селигдару» помогает новый виток ралли золота,https://www.finam.ru/publications/item/rynok-spolzaet-vniz-v-chisle-favoritov-dnya-seligdar-akron-i-novatek-20260120-1940/,https://www.finam.ru/quote/moex/akrn/publications/
AKRN,2026-01-20,2026-01,20.01.26,Правительство включило «Акрон» в перечень экономически значимых организаций,"Статус ЭЗО дает право контролирующим акционерам перевести в российскую юрисдикцию акции и доли компании, принадлежащие иностранным инвесторам из недружественных государств",https://www.finam.ru/publications/item/pravitelstvo-vklyuchilo-akron-v-perechen-ekonomicheski-znachimykh-organizatsiy-20260120-1837/,https://www.finam.ru/quote/moex/akrn/publications/
AKRN,2026-01-13,2026-01,13.01.26,"""Акрон"" сильно зависит от конъюнктуры - цен на удобрения","Ликвидность акций низкая, поэтому они могут годами торговаться в боковике",https://www.finam.ru/publications/item/akron-silno-zavisit-ot-konyunktury-tsen-na-udobreniya-20260113-1215/,https://www.finam.ru/quote/moex/akrn/publications/
AKRN,2025-12-30,2025-12,30.12.25,Предновогодняя эйфория,Инвесторы хватаются за любой позитив,https://www.finam.ru/publications/item/prednovogodnyaya-eyforiya-20251230-1434/,https://www.finam.ru/quote/moex/akrn/publications/
AKRN,2025-12-30,2025-12,30.12.25,Выпуск и экспорт удобрений в 2025 году уверенно растут,Российские производители удобрений в 2025 году нарастили экспорт и производство на фоне новых санкций ЕС,https://www.finam.ru/publications/item/vypusk-i-eksport-udobreniy-v-2025-godu-uverenno-rastut-20251230-1139/,https://www.finam.ru/quote/moex/akrn/publications/
AKRN,2025-12-22,2025-12,22.12.25,Облигации «Акрона» — удобряем портфель валютой,"Аналитики ""Финама"" отмечают, что юаневые выпуски ""Акрона"" остаются одним из лучших форматов среди надежных промышленных эмитентов для долгосрочного валютного портфеля",https://www.finam.ru/publications/item/obligatsii-akrona--udobryaem-portfel-valyutoy-20251222-1700/,https://www.finam.ru/quote/moex/akrn/publications/
AKRN,2025-12-18,2025-12,18.12.25,Рынок замер в ожидании решения Банка России по ставке,"Нет сомнений в снижении ставки, вопрос лишь в шаге",https://www.finam.ru/publications/item/rynok-zamer-v-ozhidanii-resheniya-banka-rossii-po-stavke-20251218-2051/,https://www.finam.ru/quote/moex/akrn/publications/
AKRN,2025-12-18,2025-12,18.12.25,Российская индустрия минудобрений по итогам 2025 года выходит на новый исторический максимум,"Экспорт увеличится на 7% в годовом выражении, до 45 млн тонн",https://www.finam.ru/publications/item/rossiyskaya-industriya-minudobreniy-po-itogam-2025-goda-vykhodit-na-novyy-istoricheskiy-maksimum-20251218-1940/,https://www.finam.ru/quote/moex/akrn/publications/
AKRN,2025-12-15,2025-12,15.12.25,Конкуренция в импорте удобрений в 2026 году усилится,Стоимость ценных бумаг российских производителей удобрений на этом фоне в ближайшие месяцы может оказаться под давлением,https://www.finam.ru/publications/item/konkurentsiya-v-importe-udobreniy-v-2026-godu-usilitsya-20251215-1425/,https://www.finam.ru/quote/moex/akrn/publications/
AKRN,2025-12-09,2025-12,09.12.25,Нефть и геополитический фактор давят на российский рынок акций,"Индексы снижаются на 0,28%",https://www.finam.ru/publications/item/neft-i-geopoliticheskiy-faktor-davyat-na-rossiyskiy-rynok-aktsiy-20251209-1020/,https://www.finam.ru/quote/moex/akrn/publications/
AKRN,2025-12-09,2025-12,09.12.25,«Базис» завершит прием заявок на участие в IPO - основные события 9 декабря,"«Сбер» представит результаты за 11 месяцев, стартует двухдневное заседание ФРС",https://www.finam.ru/publications/item/aktsionery-nkkhp-i-permenergosbyta-primut-reshenie-po-dividendam-osnovnye-sobytiya-9-dekabrya-20251209-0900/,https://www.finam.ru/quote/moex/akrn/publications/
AKRN,2025-12-09,2025-12,09.12.25,9 декабря закроется реестр для получения дивидендов от «Акрона»,Ранее акционеры «Акрона» утвердили дивиденды за 9 месяцев в 189 рублей на акцию,https://www.finam.ru/publications/item/9-dekabrya-zakroetsya-reestr-dlya-polucheniya-dividendov-ot-akrona-20251209-0200/,https://www.finam.ru/quote/moex/akrn/publications/
AKRN,2025-12-08,2025-12,08.12.25,Геополитика толкает рынок вверх,"Поддержку оказывает ожидание встречи лидеров Великобритании, Франции, Германии и Украины, что рынок расценивают как шаг к снижению напряженности",https://www.finam.ru/publications/item/geopolitika-tolkaet-rynok-vverkh-20251208-1225/,https://www.finam.ru/quote/moex/akrn/publications/
AKRN,2025-12-08,2025-12,08.12.25,Акционеры «Ренессанс Страхования» решат вопрос дивидендов - основные события 8 декабря,Вступает в силу решение ЦБ о снятии ограничений на перевод средств за рубеж для граждан РФ и дружественных стран,https://www.finam.ru/publications/item/aktsionery-renessans-strakhovaniya-progolosuyut-po-dividendam-osnovnye-sobytiya-8-dekabrya-20251208-0900/,https://www.finam.ru/quote/moex/akrn/publications/
AKRN,2025-12-08,2025-12,08.12.25,8 декабря последний день для покупки акций «Акрона» под дивиденд,Ранее акционеры «Акрона» утвердили дивиденды за 9 месяцев в 189 рублей на акцию,https://www.finam.ru/publications/item/8-dekabrya-posledniy-den-dlya-pokupki-aktsiy-akrona-pod-dividend-20251208-0555/,https://www.finam.ru/quote/moex/akrn/publications/
AKRN,2025-12-03,2025-12,03.12.25,Акционеры «Акрона» утвердили дивиденды за 9 месяцев в 189 рублей на акцию,Закрытие дивидендного реестра назначено на 9 декабря,https://www.finam.ru/publications/item/aktsionery-akrona-utverdili-dividendy-za-9-mesyatsev-v-189-rubley-na-aktsiyu-20251203-1555/,https://www.finam.ru/quote/moex/akrn/publications/
AKRN,2025-11-28,2025-11,28.11.25,"Бумаги ""Акрона"" переоценены относительно сектора","С форвардным EV/EBITDA 2025П 8,4х “Акрон” остается одной из самых дорогих компаний российского сектора металлов и добычи",https://www.finam.ru/publications/item/bumagi-akrona-pereotseneny-otnositelno-sektora-20251128-1605/,https://www.finam.ru/quote/moex/akrn/publications/
AKRN,2025-11-28,2025-11,28.11.25,Структура новостей для “Акрона” остается позитивной,Акции способны закрепиться выше 18500–19000 рублей в краткосрочной перспективе,https://www.finam.ru/publications/item/struktura-novostey-dlya-akrona-ostaetsya-pozitivnoy-20251128-1514/,https://www.finam.ru/quote/moex/akrn/publications/
AKRN,2025-11-28,2025-11,28.11.25,"Позитив вернулся на рынок, но надолго ли",Сегодня поддержку оказывает встреча Владимира Путина с премьер-министром Венгрии Виктором Орбаном,https://www.finam.ru/publications/item/pozitiv-vernulsya-na-rynok-no-nadolgo-li-20251128-1506/,https://www.finam.ru/quote/moex/akrn/publications/
AKRN,2025-11-28,2025-11,28.11.25,Чистая прибыль «Акрона» по МСФО за 9 месяцев выросла на 82%,Выручка возросла на 24%,https://www.finam.ru/publications/item/chistaya-pribyl-akrona-po-msfo-za-9-mesyatsev-vyrosla-na-82-20251128-1312/,https://www.finam.ru/quote/moex/akrn/publications/
AKRN,2025-11-28,2025-11,28.11.25,"Акционеры «Акрона» проголосуют по дивидендам, ВТБ и SFI представят отчетность – основные события 28 ноября",Мосбиржа добавит 5 иностранных бумаг в перечень инструментов на внебиржевом рынке акций,https://www.finam.ru/publications/item/aktsionery-akrona-progolosuyut-po-dividendam-sfi-predstavit-otchetnost-osnovnye-sobytiya-28-noyabrya-20251128-0900/,https://www.finam.ru/quote/moex/akrn/publications/
AKRN,2025-11-28,2025-11,28.11.25,"Акционеры ""Акрона"" на ВОСА 28 ноября одобрят дивиденды",Закрытие реестра для участия - 4 ноября,https://www.finam.ru/publications/item/aktsionery-akrona-na-fosa-28-noyabrya-odobryat-dividendy-20251128-0740/,https://www.finam.ru/quote/moex/akrn/publications/
AKRN,2025-11-19,2025-11,19.11.25,"Предстоящее ослабление рубля будет существенно влиять на доходы ""Акрона""","Как только рубль преодолеет отметку 85-90 за доллар, выручка и чистая прибыль всех экспортеров будет расти",https://www.finam.ru/publications/item/predstoyashchee-oslablenie-rublya-budet-sushchestvenno-vliyat-na-dokhody-akrona-20251119-1730/,https://www.finam.ru/quote/moex/akrn/publications/
AKRN,2025-11-19,2025-11,19.11.25,"Низкая ликвидность акций ""Акрона"" может препятствовать справедливой переоценке","Free-float компании составляет лишь 4,0%",https://www.finam.ru/publications/item/nizkaya-likvidnost-aktsiy-akrona-mozhet-prepyatstvovat-spravedlivoy-pereotsenke-20251119-1525/,https://www.finam.ru/quote/moex/akrn/publications/
AKRN,2025-11-18,2025-11,18.11.25,«Акрон» за 10 месяцев поставил на российский рынок 1 млн тонн удобрений,Поставки карбамида выросли в пять раз,https://www.finam.ru/publications/item/akron-za-10-mesyatsev-postavil-na-rossiyskiy-rynok-1-mln-tonn-udobreniy-20251118-1056/,https://www.finam.ru/quote/moex/akrn/publications/
AKRN,2025-11-17,2025-11,17.11.25,Зимний дивидендный сезон. Лидеры по доходности,Какие акции стоит приобретать в расчете на дивиденды,https://www.finam.ru/publications/item/zimniy-dividendnyy-sezon-lidery-po-dokhodnosti-20251117-1629/,https://www.finam.ru/quote/moex/akrn/publications/
AKRN,2025-11-10,2025-11,10.11.25,«Дорогобуж» нарастил производство аммиака до 830 тысяч тонн в год,В 2025 году агрегат выведен на мощность 2300 тонн в сутки,https://www.finam.ru/publications/item/dorogobuzh-narastil-proizvodstvo-ammiaka-do-830-tysyach-tonn-v-god-20251110-1236/,https://www.finam.ru/quote/moex/akrn/publications/
AKRN,2025-11-07,2025-11,07.11.25,Индекс МосБиржи продолжает восстановление,Российский рынок показывает рост после двух дней снижения,https://www.finam.ru/publications/item/indeks-mosbirzhi-prodolzhaet-vosstanovlenie-20251107-1855/,https://www.finam.ru/quote/moex/akrn/publications/
AKRN,2025-11-07,2025-11,07.11.25,"Чистая прибыль ""Акрона"" по РСБУ за 9 месяцев 2025 года выросла в 2,6 раза",Выручка в отчетном периоде увеличилась на 19%,https://www.finam.ru/publications/item/chistaya-pribyl-akrona-po-rsbu-za-9-mesyatsev-2025-goda-vyrosla-v-26-raza-20251107-1110/,https://www.finam.ru/quote/moex/akrn/publications/
AKRN,2025-11-05,2025-11,05.11.25,Ядерное напряжение растет,Инвесторы не справились с давлением,https://www.finam.ru/publications/item/yadernoe-napryazhenie-rastet-20251105-2057/,https://www.finam.ru/quote/moex/akrn/publications/
AKRN,2025-11-05,2025-11,05.11.25,"Рынок испытал геополитический ""криз""",Инвесторы отреагировали резкими продажами на ядерную риторику США и России,https://www.finam.ru/publications/item/rynok-ispytal-geopoliticheskiy-kriz-20251105-1857/,https://www.finam.ru/quote/moex/akrn/publications/
AKRN,2025-11-05,2025-11,05.11.25,"""Акрон"" может выплатить дивиденды за 9 месяцев в размере 189 рублей на акцию","Закрытие дивидендного реестра, предварительно, 9 декабря",https://www.finam.ru/publications/item/akron-mozhet-vyplatit-dividendy-za-9-mesyatsev-v-razmere-189-rubley-na-aktsiyu-20251105-1624/,https://www.finam.ru/quote/moex/akrn/publications/
AKRN,2025-11-05,2025-11,05.11.25,Рынок демонстрирует попытки роста на низких объемах,"Акции «ЛУКОЙЛа» остаются под давлением, в ОГК-2 - дивидендный гэп",https://www.finam.ru/publications/item/rynok-demonstriruet-popytki-rosta-na-nizkikh-obemakh-20251105-1442/,https://www.finam.ru/quote/moex/akrn/publications/
AKRN,2025-11-05,2025-11,05.11.25,Рынок снижается в ожидании свежих драйверов,Позитивный импульс выходных исчерпал себя,https://www.finam.ru/publications/item/rynok-snizhaetsya-v-ozhidanii-svezhikh-drayverov-20251105-0943/,https://www.finam.ru/quote/moex/akrn/publications/
AKRN,2025-11-05,2025-11,05.11.25,"""СД ""Акрона"" обсудит дивиденды 5 ноября",Также совет директоров обсудит подготовку к ВОСА,https://www.finam.ru/publications/item/sd-akrona-obsudit-dividendy-5-noyabrya-20251105-0914/,https://www.finam.ru/quote/moex/akrn/publications/
AKRN,2025-11-05,2025-11,05.11.25,"Советы директоров ""Полюса"" и ""Акрона"" обсудят дивиденды - основные события 5 ноября",Верховный суд США рассмотрит дело о законности пошлин президента страны Дональда Трампа,https://www.finam.ru/publications/item/sovet-direktorov-polyusa-obsudit-dividendy-osnovnye-sobytiya-5-noyabrya-20251105-0900/,https://www.finam.ru/quote/moex/akrn/publications/
AKRN,2025-11-05,2025-11,05.11.25,"Рынки фиксируют прибыль, волатильность бьет рекорды","Азия в минусе, рынки штормит после ралли",https://www.finam.ru/publications/item/rynki-fiksiruyut-pribyl-volatilnost-bet-rekordy-20251105-0830/,https://www.finam.ru/quote/moex/akrn/publications/
AKRN,2025-11-01,2025-11,01.11.25,Успешный месяц 2025 года. Оправдает ли ноябрь свою репутацию?,На российском рынке есть поводы для оптимизма,https://www.finam.ru/publications/item/uspeshnyy-mesyats-2025-goda-opravdaet-li-noyabr-svoyu-reputatsiyu-20251101-1853/,https://www.finam.ru/quote/moex/akrn/publications/
AKRN,2025-11-01,2025-11,01.11.25,"Прогнозы на ноябрь - нисходящие риски в акциях сохраняются, рубль стабилен",Российский рынок в ноябре останется во власти геополитических факторов,https://www.finam.ru/publications/item/prognozy-na-noyabr-niskhodyashchie-riski-v-aktsiyakh-sokhranyayutsya-rubl-stabilen-20251101-1300/,https://www.finam.ru/quote/moex/akrn/publications/
AKRN,2025-10-31,2025-10,31.10.25,Поводов для роста все еще нет,Рынок готов к коррекционному отскоку,https://www.finam.ru/publications/item/povodov-dlya-rosta-vse-eshche-net-20251031-1928/,https://www.finam.ru/quote/moex/akrn/publications/
AKRN,2025-10-31,2025-10,31.10.25,"""Акрон"" разместил биржевые облигации на $150 млн",Эмитент реализовал по открытой подписке 150 000 облигаций серии БО-002Р-01 номинальной стоимостью $1000 каждая,https://bonds.finam.ru/news/item/-akron-razmestil-birzhevye-obligatsii-na-150-mln/,https://www.finam.ru/quote/moex/akrn/publications/
AKRN,2025-10-30,2025-10,30.10.25,"Россия за 9 месяцев экспортировала 33,7 млн тонн минеральных удобрений","Ожидается, что к концу года показатель может достичь рекордных 45 млн тонн",https://www.finam.ru/publications/item/rossiya-za-9-mesyatsev-eksportirovala-337-mln-tonn-mineralnykh-udobreniy-20251030-1842/,https://www.finam.ru/quote/moex/akrn/publications/
AKRN,2025-10-30,2025-10,30.10.25,"Ставка 1-го купона по облигациям ""Акрона"" на $150 млн составит 7,7% годовых","Первоначально ориентир по ставке 1-го купона находился в диапазоне 8,00 - 8,25% годовых",https://bonds.finam.ru/news/item/stavka-1-go-kupona-po-obligatsiam-akrona-na-150-mln-sostavit-7-7-godovykh/,https://www.finam.ru/quote/moex/akrn/publications/
AKRN,2025-10-27,2025-10,27.10.25,"Объем биржевых торгов минудобрениями в сентябре вырос в 4,2 раза",Общий объем торгов минудобрениями с начала года превысил 200 тысяч тонн,https://www.finam.ru/publications/item/obem-birzhevykh-torgov-minudobreniyami-v-sentyabre-vyros-v-42-raza-20251027-1040/,https://www.finam.ru/quote/moex/akrn/publications/
AKRN,2025-10-22,2025-10,22.10.25,"""Акрон"" 29 октября проведет сбор заявок на облигации в долларах","Ориентир по ставке 1-го купона находится в диапазоне 8,00 - 8,25% годовых",https://bonds.finam.ru/news/item/-akron-29-oktyabrya-provedet-sbor-zayavok-na-obligatsii-v-dollarakh/,https://www.finam.ru/quote/moex/akrn/publications/
