ticker,date,date_ym,date_raw,title,text,url,source_page
KAZT,2025-12-31,2025-12,31.12.25,Прогноз на 2026 год - ожидания позитивные,"Диверсификация между растущими акциями и облигациями создаст всепогодный портфель, готовый к любым сценариям",https://www.finam.ru/publications/item/prognoz-na-2026-god-ozhidaniya-pozitivnye-20251231-1500/,https://www.finam.ru/quote/moex/kazt/publications/
KAZT,2025-10-30,2025-10,30.10.25,"Россия за 9 месяцев экспортировала 33,7 млн тонн минеральных удобрений","Ожидается, что к концу года показатель может достичь рекордных 45 млн тонн",https://www.finam.ru/publications/item/rossiya-za-9-mesyatsev-eksportirovala-337-mln-tonn-mineralnykh-udobreniy-20251030-1842/,https://www.finam.ru/quote/moex/kazt/publications/
KAZT,2025-10-27,2025-10,27.10.25,"Объем биржевых торгов минудобрениями в сентябре вырос в 4,2 раза",Общий объем торгов минудобрениями с начала года превысил 200 тысяч тонн,https://www.finam.ru/publications/item/obem-birzhevykh-torgov-minudobreniyami-v-sentyabre-vyros-v-42-raza-20251027-1040/,https://www.finam.ru/quote/moex/kazt/publications/
KAZT,2025-09-23,2025-09,23.09.25,“КуйбышевАзот” закроет дивидендный реестр - основные события 23 сентября,Также закроется акционеров для участия в ВОСА ОГК-2 по годовым дивидендам,https://www.finam.ru/publications/item/kuybyshevazot-zakroet-dividendnyy-reestr-osnovnye-sobytiya-23-sentyabrya-20250923-0900/,https://www.finam.ru/quote/moex/kazt/publications/
KAZT,2025-09-23,2025-09,23.09.25,Дата закрытия дивидендного реестра “КуйбышевАзота” - 23 сентября,“КуйбышевАзот” выплатит акционерам-владельцам привилегированных и обыкновенных акций дивиденды в размере 4 рубля на бумагу,https://www.finam.ru/publications/item/data-zakrytiya-dividendnogo-reestra-kuybyshevazota-23-sentyabrya-20250923-0802/,https://www.finam.ru/quote/moex/kazt/publications/
KAZT,2025-09-22,2025-09,22.09.25,Последний день торгов Ozon в режиме Т+1   - основные события 22 сентября,Акционеры “Озон Фармацевтики” примут решение по дивидендам,https://www.finam.ru/publications/item/dividendy-ozon-farmatsevtiki-osnovnye-sobytiya-22-sentyabrya-20250922-0900/,https://www.finam.ru/quote/moex/kazt/publications/
KAZT,2025-09-22,2025-09,22.09.25,Последний день для покупки бумаг “КуйбышевАзота” под дивиденды - 22 сентября,Дата закрытия реестра на получение дивидендов - 23 сентября,https://www.finam.ru/publications/item/posledniy-den-dlya-pokupki-bumag-kuybyshevazota-pod-dividendy-22-sentyabrya-20250922-0504/,https://www.finam.ru/quote/moex/kazt/publications/
KAZT,2025-09-17,2025-09,17.09.25,“КуйбышевАзот” выплатит акционерам дивиденды в размере 4 рубля на акцию,Одобрены полугодовые выплаты,https://www.finam.ru/publications/item/kuybyshevazot-vyplatit-aktsioneram-dividendy-v-razmere-4-rublya-na-aktsiyu-20250917-0856/,https://www.finam.ru/quote/moex/kazt/publications/
KAZT,2025-09-12,2025-09,12.09.25,Заседание Банка России по ставке - основные события 12 сентября,"Кроме того, акционеры «КуйбышевАзота» проголосуют по дивидендам за 1 полугодие",https://www.finam.ru/publications/item/zasedanie-banka-rossii-po-stavke-osnovnye-sobytiya-12-sentyabrya-20250912-0900/,https://www.finam.ru/quote/moex/kazt/publications/
KAZT,2025-09-12,2025-09,12.09.25,Акционеры «КуйбышевАзота» 12 сентября проголосуют по дивидендам за 1 полугодие,Ранее СД рекомендовал выплатить 4 рубля на каждый тип акций,https://www.finam.ru/publications/item/aktsionery-kuybyshevazota-12-sentyabrya-progolosuyut-po-dividendam-za-1-polugodie-20250912-0511/,https://www.finam.ru/quote/moex/kazt/publications/
KAZT,2025-08-18,2025-08,18.08.25,Кто заплатит за дефицит бюджета,"За первое полугодие 2025 года дефицит взлетел до 3,7 трлн рублей",https://www.finam.ru/publications/item/kto-zaplatit-za-defitsit-byudzheta-20250818-1040/,https://www.finam.ru/quote/moex/kazt/publications/
KAZT,2025-08-18,2025-08,18.08.25,Трамп встретится с Зеленским и лидерами ЕС - основные события 18 августа,Банки России начнут рассчитывать нормативы достаточности капитала по новым правилам,https://www.finam.ru/publications/item/kuybyshevazot-zakroet-reestr-aktsionerov-dlya-uchastiya-v-vosa-osnovnye-sobytiya-18-avgusta-20250818-0900/,https://www.finam.ru/quote/moex/kazt/publications/
KAZT,2025-08-18,2025-08,18.08.25,Реестр акционеров «КуйбышевАзота» для участия в ВОСА закрывается 18 августа,Собрание по вопросы выплаты дивидендов за 1 полугодие пройдет 12 сентября,https://www.finam.ru/publications/item/reestr-aktsionerov-kuybyshevazota-dlya-uchastiya-v-vosa-zakryvaetsya-18-avgusta-20250818-0359/,https://www.finam.ru/quote/moex/kazt/publications/
KAZT,2025-08-11,2025-08,11.08.25,Все внимание сосредоточено на Аляске,Инвесторы ждут позитивных новостей по итогам переговоров Путина и Трампа на Аляске,https://www.finam.ru/publications/item/vse-vnimanie-na-alyasku-20250811-2030/,https://www.finam.ru/quote/moex/kazt/publications/
KAZT,2025-08-11,2025-08,11.08.25,СД «Куйбышевазота» рекомендовал дивиденды за 1 полугодие в размере 4 рублей на каждый тип акций,Рекомендовано установить 23 сентября как дату закрытия дивидендного реестра,https://www.finam.ru/publications/item/sd-kuybyshevazota-rekomendoval-dividendy-za-1-polugodie-v-razmere-4-rubley-na-kazhdyy-tip-aktsiy-20250811-1644/,https://www.finam.ru/quote/moex/kazt/publications/
KAZT,2025-07-17,2025-07,17.07.25,Россия намерена нарастить долю на мировом рынке минудобрений к 2030 году до 25%,В 2025 году Россия планирует произвести рекордные 65 млн тонн минеральных удобрений,https://www.finam.ru/publications/item/rossiya-namerena-narastit-dolyu-na-mirovom-rynke-minudobreniy-k-2030-godu-do-25-20250717-1455/,https://www.finam.ru/quote/moex/kazt/publications/
KAZT,2025-06-09,2025-06,09.06.25,Возобновляется автоматическая конвертация депозитарных расписок  - основные события 9 июня,"Дивидендные реестры закроют ""ЭсЭфАй"", ""ФосАгро"", ""НоваБев Групп"", ""Акрон"", ""Интер РАО"", ""КуйбышевАзот""",https://www.finam.ru/publications/item/sd-gazprom-nefti-otsenit-svoyu-deyatelnost-osnovnye-sobytiya-9-iyunya-20250609-0900/,https://www.finam.ru/quote/moex/kazt/publications/
KAZT,2025-06-09,2025-06,09.06.25,Реестр для получения дивидендов “КуйбышевАзота” закроется 9 июня,"Акционеры “КуйбышевАзота” одобрили выплату дивидендов за 2024 год по всем типа акций в размере 2,5 рубля",https://www.finam.ru/publications/item/reestr-dlya-polucheniya-dividendov-kuybyshevazota-zakroetsya-9-iyunya-20250609-0234/,https://www.finam.ru/quote/moex/kazt/publications/
KAZT,2025-05-22,2025-05,22.05.25,Потолок цен на минудобрения в России сохранится на уровне сентября 2022 года,ФАС согласовала торговые политики производителей минудобрений,https://www.finam.ru/publications/item/potolok-tsen-na-minudobreniya-v-rossii-sokhranyaetsya-na-urovne-sentyabrya-2022-goda-20250522-1211/,https://www.finam.ru/quote/moex/kazt/publications/
KAZT,2025-05-16,2025-05,16.05.25,"“КуйбышевАзот” выплатит дивиденды по всем типам акций в размере 2,5 рубля",Отсечка состоится 9 июня,https://www.finam.ru/publications/item/kuybyshevazot-vyplatit-dividendy-po-vsem-tipam-aktsiy-v-razmere-25-rublya-20250516-1626/,https://www.finam.ru/quote/moex/kazt/publications/
KAZT,2025-05-15,2025-05,15.05.25,В Стамбуле начинаются переговоры по Украине – основные события 15 мая,"«Сбер» представит результаты по РСБУ за апрель, «Ростелеком» и «ФосАгро» опубликуют отчеты по МСФО за 1 квартал",https://www.finam.ru/publications/item/peregovory-v-stambule-otchetnost-sbera-po-rsbu-osnovnye-sobytiya-15-maya-20250515-0900/,https://www.finam.ru/quote/moex/kazt/publications/
KAZT,2025-05-15,2025-05,15.05.25,Акционеры «КуйбышевАзота» 15 мая проголосуют по дивидендам за 2024 год,Также планируется избрать членов совета директоров,https://www.finam.ru/publications/item/aktsionery-kuybyshevazota-15-maya-progolosuyut-po-dividendam-za-2024-god-20250515-0617/,https://www.finam.ru/quote/moex/kazt/publications/
KAZT,2025-04-20,2025-04,20.04.25,"Реестр акционеров «КуйбышевАзота», имеющих право на участие в ГОСА, закрывается 20 апреля",ГОСА по вопросу выплаты дивидендов пройдет 15 мая,https://www.finam.ru/publications/item/reestr-aktsionerov-kuybyshevazota-imeyushchikh-pravo-na-uchastie-v-gosa-zakryvaetsya-20-aprelya-20250420-0519/,https://www.finam.ru/quote/moex/kazt/publications/
KAZT,2025-04-03,2025-04,03.04.25,Чистая прибыль «КуйбышевАзота» по МСФО незначительно снизилась в 2024 году,Выручка от продаж при этом составила 81 млрд рублей,https://www.finam.ru/publications/item/chistaya-pribyl-kuybyshevazota-po-msfo-neznachitelno-snizilas-v-2024-godu-20250403-1632/,https://www.finam.ru/quote/moex/kazt/publications/
KAZT,2025-03-27,2025-03,27.03.25,В надежде на санкционные послабления сектор удобрений может получить весомую поддержку,Возможно снятие ограничений с ключевых российских предприятий агропромышленного комплекса,https://www.finam.ru/publications/item/v-nadezhde-na-sanktsionnye-poslableniya-sektor-udobreniy-mozhet-poluchit-vesomuyu-podderzhku-20250327-0950/,https://www.finam.ru/quote/moex/kazt/publications/
KAZT,2024-12-02,2024-12,02.12.24,Акционеры «Полюса» примут решение по дивидендам - основные события 2 декабря,Расписки «Русагро» последний день торгуются на Мосбирже в стакане Т+1,https://www.finam.ru/publications/item/aktsionery-polyusa-primut-reshenie-po-dividendam-osnovnye-sobytiya-2-dekabrya-20241202-0900/,https://www.finam.ru/quote/moex/kazt/publications/
KAZT,2024-11-25,2024-11,25.11.24,"Акционеры ""КуйбышевАзота"" утвердили дивиденды за 9 месяцев",Закрытие реестра акционеров для получения дивидендов - 3 декабря,https://www.finam.ru/publications/item/aktsionery-kuybyshevazota-utverdili-dividendy-za-9-mesyatsev-20241125-1239/,https://www.finam.ru/quote/moex/kazt/publications/
KAZT,2024-11-22,2024-11,22.11.24,«Займер» и «Диасофт» обсудят дивиденды - основные события 22 ноября,Акции «ТКС Холдинга» последний день торгуются с дивидендами,https://www.finam.ru/publications/item/sd-zaymera-i-diasofta-obsudyat-dividendy-osnovnye-sobytiya-22-noyabrya-20241122-0900/,https://www.finam.ru/quote/moex/kazt/publications/
KAZT,2024-11-22,2024-11,22.11.24,22 ноября акционеры «КуйбышевАзота» примут решение по дивидендам,Совет директоров компании рекомендовал дивиденды в 7 рублей на оба типа акций по результатам 9 месяцев 2024 года,https://www.finam.ru/publications/item/22-noyabrya-aktsionery-kuybyshevazota-primut-reshenie-po-dividendam-20241122-0330/,https://www.finam.ru/quote/moex/kazt/publications/
KAZT,2024-11-13,2024-11,13.11.24,В России обсуждают индексацию внутренних цен на удобрения с начала 2025 года,Производители удобрений просят Минпромторг проиндексировать цены на их продукцию на 15% с января следующего года,https://www.finam.ru/publications/item/v-rossii-obsuzhdayut-indeksatsiyu-vnutrennikh-tsen-na-udobreniya-s-nachala-2025-goda-20241113-0925/,https://www.finam.ru/quote/moex/kazt/publications/
KAZT,2024-11-08,2024-11,08.11.24,ЕС отказался от санкций на российские удобрения,Теперь в Европе обсуждают введение повышенных пошлин на российскую химическую продукцию,https://www.finam.ru/publications/item/v-es-obsuzhdayut-povyshennye-poshliny-na-khimicheskuyu-produktsiyu-iz-rossii-20241108-0927/,https://www.finam.ru/quote/moex/kazt/publications/
KAZT,2024-11-07,2024-11,07.11.24,Выпуск минеральных удобрений в России может приблизиться к 29 млн тонн,За 2024 год производство удобрений выросло на 10-12%,https://www.finam.ru/publications/item/vypusk-mineralnykh-udobreniy-v-rossii-mozhet-priblizitsya-k-29-mln-tonn-20241107-1120/,https://www.finam.ru/quote/moex/kazt/publications/
KAZT,2024-10-28,2024-10,28.10.24,ВТБ отчитается за квартал - основные события 28 октября,“Норильский никель” планирует опубликовать результаты производственной деятельности,https://www.finam.ru/publications/item/vtb-otchitaetsya-za-kvartal-osnovnye-sobytiya-28-oktyabrya-20241028-0900/,https://www.finam.ru/quote/moex/kazt/publications/
KAZT,2024-10-28,2024-10,28.10.24,28 октября «КуйбышевАзот» закроет реестр для участия в ВОСА по вопросу дивидендов,Совет директоров компании рекомендовал дивиденды в 7 рублей на оба типа акций по результатам 9 месяцев 2024 года,https://www.finam.ru/publications/item/28-oktyabrya-kuybyshevazot-zakroet-reestr-dlya-uchastiya-v-vosa-po-voprosu-dividendov-20241028-0430/,https://www.finam.ru/quote/moex/kazt/publications/
KAZT,2024-10-22,2024-10,22.10.24,Совет директоров «КуйбышевАзота» рекомендовал промежуточные дивиденды в 7 рублей на оба типа акций,Речь идет о дивидендах по результатам 9 месяцев 2024 года,https://www.finam.ru/publications/item/sovet-direktorov-kuybyshevazota-rekomendoval-promezhutochnye-dividendy-v-7-rubley-na-oba-tipa-aktsiy-20241022-1024/,https://www.finam.ru/quote/moex/kazt/publications/
KAZT,2024-10-18,2024-10,18.10.24,Китайские акции выросли благодаря запуску своп-программы ЦБ,"Смотрите утренний обзор и задавайте свои вопросы в прямом эфире на канале ""Финам Инвестиции""",https://www.finam.ru/publications/item/kitayskie-aktsii-vyrosli-blagodarya-zapusku-svop-programmy-tsb-20241018-0940/,https://www.finam.ru/quote/moex/kazt/publications/
KAZT,2024-08-29,2024-08,29.08.24,Чистая прибыль «КуйбышевАзота» по МСФО упала в 1 полугодии на 28%,"Выручка от продаж, в свою очередь, возросла на 15% г/г, до 43,633 млрд рублей",https://www.finam.ru/publications/item/chistaya-pribyl-kuybyshevazota-po-msfo-upala-v-1-polugodii-na-28-20240829-1930/,https://www.finam.ru/quote/moex/kazt/publications/
KAZT,2024-07-04,2024-07,04.07.24,КуйбышевАзот ПАО - Дивиденды в денежной форме,,https://www.finam.ru/publications/item/kuybyshevazot-pao-dividendy-v-denezhnoy-forme-20240704-0218/,https://www.finam.ru/quote/moex/kazt/publications/
KAZT,2024-07-03,2024-07,03.07.24,КуйбышевАзот ПАО - Дивиденды в денежной форме,,https://www.finam.ru/publications/item/kuybyshevazot-pao-dividendy-v-denezhnoy-forme-20240703-0218/,https://www.finam.ru/quote/moex/kazt/publications/
KAZT,2024-06-12,2024-06,12.06.24,КуйбышевАзот ПАО - Дивиденды в денежной форме,,https://www.finam.ru/publications/item/kuybyshevazot-pao-dividendy-v-denezhnoy-forme-20240612-0210/,https://www.finam.ru/quote/moex/kazt/publications/
KAZT,2024-06-04,2024-06,04.06.24,КуйбышевАзот ПАО - Дивиденды в денежной форме,,https://www.finam.ru/publications/item/kuybyshevazot-pao-dividendy-v-denezhnoy-forme-20240604-0211/,https://www.finam.ru/quote/moex/kazt/publications/
KAZT,2024-05-30,2024-05,30.05.24,«КуйбышевАзот» открыл производство полимер-композиционных материалов в Индии,Доля  ПАО «КуйбышевАзот» в совместном предприятии Kuibyshevazot Engineering Plastics (India) Pvt. Ltd составляет 80%,https://www.finam.ru/publications/item/kuybyshevazot-otkryl-proizvodstvo-polimer-kompozitsionnykh-materialov-v-indii-20240530-1232/,https://www.finam.ru/quote/moex/kazt/publications/
KAZT,2024-05-23,2024-05,23.05.24,КуйбышевАзот ПАО - Годовое общее собрание акционеров - ИТОГИ,,https://www.finam.ru/publications/item/kuybyshevazot-pao-godovoe-obshchee-sobranie-aktsionerov-itogi-20240523-0211/,https://www.finam.ru/quote/moex/kazt/publications/
KAZT,2024-05-21,2024-05,21.05.24,КуйбышевАзот ПАО - Дивиденды в денежной форме,,https://www.finam.ru/publications/item/kuybyshevazot-pao-dividendy-v-denezhnoy-forme-20240521-0212/,https://www.finam.ru/quote/moex/kazt/publications/
KAZT,2024-05-21,2024-05,21.05.24,КуйбышевАзот ПАО - Годовое общее собрание акционеров - ИТОГИ,,https://www.finam.ru/publications/item/kuybyshevazot-pao-godovoe-obshchee-sobranie-aktsionerov-itogi-20240521-0207/,https://www.finam.ru/quote/moex/kazt/publications/
KAZT,2024-05-16,2024-05,16.05.24,Путин начал визит в Китай - основные события 16 мая,"Сегодня финансовую отчетность опубликуют ""ТКС Холдинг"" и ""Софтлайн""",https://www.finam.ru/publications/item/tks-kholding-otchitaetsya-za-kvartal-osnovnye-sobytiya-16-maya-20240516-0900/,https://www.finam.ru/quote/moex/kazt/publications/
KAZT,2024-05-16,2024-05,16.05.24,ГОСА «КуйбышевАзота» по вопросу дивидендов за 2023 год пройдет 16 мая,Ранее совет директоров рекомендовал акционерам выплатить дивиденды за 2023 год в размере 15 рублей на каждый тип акций,https://www.finam.ru/publications/item/gosa-kuybyshevazota-po-voprosu-dividendov-za-2023-god-proydet-16-maya-20240516-0530/,https://www.finam.ru/quote/moex/kazt/publications/
KAZT,2024-04-27,2024-04,27.04.24,"Чистая прибыль «КуйбышевАзота» по РСБУ снизилась в 1 квартале в 2,4 раза","Выручка между тем увеличилась незначительно и составила 20,8 млрд рублей",https://www.finam.ru/publications/item/chistaya-pribyl-kuybyshevazota-po-rsbu-snizilas-v-1-kvartale-v-24-raza-20240427-0913/,https://www.finam.ru/quote/moex/kazt/publications/
KAZT,2024-04-25,2024-04,25.04.24,КуйбышевАзот ПАО - Годовое общее собрание акционеров,,https://www.finam.ru/publications/item/kuybyshevazot-pao-godovoe-obshchee-sobranie-aktsionerov-20240425-0218/,https://www.finam.ru/quote/moex/kazt/publications/
KAZT,2024-04-22,2024-04,22.04.24,КуйбышевАзот ПАО - Годовое общее собрание акционеров,,https://www.finam.ru/publications/item/kuybyshevazot-pao-godovoe-obshchee-sobranie-aktsionerov-20240422-0205/,https://www.finam.ru/quote/moex/kazt/publications/
